name;description;artist;materials_techniques;creation_year;media;image;status;dev_qr_code;prod_qr_code;slug
Le Louvre;Le Palais du Louvre est un monument emblématique de Paris. Le chateau fut construit comme une forteresse médiévale par Philippe-Auguste en 1190 pour protéger Paris des invasions ennemies. Au fil des siècles, le palais a été agrandi et rénové par de ombreux souverains, notamment François Ier. Au 17ème siècle, le palais a été transformé en un palais royal luxueux sous Louis XIV, avec des jardins somptueux et de magnifiques salles d'apparat. Pendant la Révolution française, le palais a été transformé en musée, et a ouvert ses portes au public en 1793 sous le nom de Musée du Louvre. Le Louvre est l'un des plus grands musées du monde, attirant des millions de visiteurs chaque année pour découvrir ses collections d'art exceptionnelles et son architecture historique. ;Le roi Philippe-Auguste;;1190;https://www.youtube.com/watch?v=V9vw2TGc06Q;https://presse.louvre.fr/wp-content/uploads/2022/06/1654857279_cour-napolon-et-pyramide-pyramide-du-louvre-arch-i-m-pei-muse-du-louvre-dist.jpg;waiting_for_answer;https://res.cloudinary.com/dqhw6sqcy/image/upload/v1678375432/ArtUp/dev_louvre_wdhl2i.png;https://res.cloudinary.com/dqhw6sqcy/image/upload/v1678375432/ArtUp/prod_louvre_aggobx.png;louvre
La Vierge au coussin vert;Vous pensez peut-être à Léonard de Vinci ? Vous avez bien raison ! Car le peintre Solario était un contemporain du génie de la Renaissance italienne et a bénéficié de son influence. Le décor champêtre qui constitue le fond de la scène sacrée, une Vierge à l’Enfant, ne correspond ni aux paysages de la Bible ni à la campagne vénitienne, région natale de l’artiste. Il donne un caractère intemporel à la composition et renforce l’émotion proprement humaine qui y est représentée?: la douceur extrême qui émane de tous les éléments fait de la maternité le vrai sujet, universel. Le regard attendri de la mère plongé dans celui de son enfant, le geste charmant du nourrisson qui joue avec son pied et enfin le moelleux de ce fameux coussin vert – auquel le tableau doit son nom – traduisent le bonheur intense de l’amour maternel.;Andrea Solari;huile sur bois;vers 1507 - 1510;https://www.youtube.com/watch?v=-3Avz8_zwxg;https://www.tableauxcelebres.com/pages/catalogue/images/max-la-vierge-au-coussin-vert-tableau-peint-par-andrea-solari-qkoxv.jpg;locked;https://res.cloudinary.com/dqhw6sqcy/image/upload/v1678375032/ArtUp/dev_coussin_jrxbpb.png;https://res.cloudinary.com/dqhw6sqcy/image/upload/v1678375432/ArtUp/prod_coussin_ktaiz7.png;coussin
Pietà;La Pietà désigne la Vierge au moment de la descente de Croix du Christ et avant sa mise au tombeau. Le peintre Rosso Fiorentino n’a pas choisi de représenter la mère tenant son fils sur ses genoux, comme sont mises en scène la plupart des Pietà. Il fait de la tragédie un mouvement qui occupe toute la largeur du tableau : la Vierge, en proie à la douleur, déploie ses bras en défaillant. Les étoffes drapées et chatoyantes des personnages secondaires contribuent elles aussi à cette agitation, troublante dans une scène de recueillement. Quant au corps du Christ, il semble démesurément grand. Ces exagérations sont typiques du maniérisme dont Rosso était l’un des représentants. François Ier apprécie les Italiens maniéristes. Ce n’est pas le cas des autorités catholiques qui bannissent leur style jugé trop expressif.;Rosso Fiorentino;huile sur toile;2e quart du XVIe siècle (vers 1530 - 1540);https://www.youtube.com/watch?v=9TsqD13iGG8;https://collections.louvre.fr/media/cache/intermediate/0000000021/0000061332/0000386648_OG.JPG;locked;https://res.cloudinary.com/dqhw6sqcy/image/upload/v1678375433/ArtUp/dev_pieta_jdrfop.png;https://res.cloudinary.com/dqhw6sqcy/image/upload/v1678375432/ArtUp/prod_pieta_yvbvn7.png;pieta
La Joconde;Lisa Gherardini, épouse de Francesco del Giocondo. Le portrait le plus célèbre du monde, et un sourire qui fait écho à ce nom de « giocondo », « bienheureux » en italien. Est-ce parce que son sourire nous rappelle celui de notre mère quand nous étions bébé, comme le pensait l’inventeur de la psychanalyse Sigmund Freud?? Est-ce à cause de ce fabuleux sfumato, technique de Léonard de Vinci qui consistait à superposer de minces couches de glacis transparent afin d'obtenir une sorte de brume dotant le portrait d’une impression de vie?? Est-ce tout simplement parce que c’est l’œuvre du génie incontesté de la Renaissance italienne?? Ou bien est-ce parce que le tableau a été volé, puis retrouvé et que la presse en a tant parlé?? Est-ce encore parce que les artistes n’ont cessé de la copier ou de la détourner?? En fait, c’est pour toutes ces raisons et bien d’autres encore que La Joconde incarne la définition du chef-d’œuvre.;Léonard de Vinci;huile sur toile;1600 / 1700 (XVIIe siècle);https://www.youtube.com/watch?v=I_zTG8UQ7mg;https://collections.louvre.fr/media/cache/small/0000000021/0000062370/0000598561_OG.JPG;locked;https://res.cloudinary.com/dqhw6sqcy/image/upload/v1678375433/ArtUp/dev_joconde_wc4zdm.png;https://res.cloudinary.com/dqhw6sqcy/image/upload/v1678375432/ArtUp/prod_joconde_brvmhx.png;joconde
Les Noces de Cana;Le Nouveau Testament raconte que c’est à Cana, ville de Galilée, que Jésus accomplit son premier miracle en transformant l’eau en vin : accompagné de sa mère, il était invité à un mariage où la boisson s’était mise à manquer. L’illustration de cet épisode biblique a été commandée à Véronèse pour orner le réfectoire d’un couvent de Venise. Le peintre met en effet la scène sacrée en images mais avec une époustouflante liberté d’interprétation. Il multiplie les personnages, au nombre de 132, mêlant les figures bibliques à des aristocrates vénitiens habillés à la mode du 16e siècle ou à des Orientaux en turban. Véronèse donne à l’ensemble un caractère théâtral en plantant un somptueux décor architectural et en utilisant des couleurs flamboyantes, grâce aux précieux pigments que les marchands vénitiens importaient d’Orient.;Véronèse;huile sur toile;XVIe siècle (1500 - 1600);https://www.youtube.com/watch?v=oEsXaw3BmrU;https://collections.louvre.fr/media/cache/small/0000000021/0000064382/0000560615_OG.JPG;locked;https://res.cloudinary.com/dqhw6sqcy/image/upload/v1678375432/ArtUp/dev_noces_nmdssl.png;https://res.cloudinary.com/dqhw6sqcy/image/upload/v1678375432/ArtUp/prod_noces_x0suwf.png;noces
La Victoire de Samothrace;Pour les Grecs de l’Antiquité, la victoire se représentait sous les traits d’une femme ailée. Niké avait un rôle de messagère, descendant sur terre pour glorifier le vainqueur. C’est sur l’île de Samothrace, au nord de la mer Égée, que cette Victoire a été retrouvée. C'était une offrande aux dieux pour un sanctuaire. Les fidèles y venaient s’initier et demander protection contre les dangers de la mer. Cette œuvre est remarquable par son mouvement?: le pied de la Victoire vient tout juste de se poser sur le navire de guerre. Le vent soulève son manteau et plaque sur son corps le «?drapé mouillé?» de son vêtement, un effet dont les sculpteurs grecs aimaient jouer…;Inconnu;Marbre / sculpture - ronde-bosse - taillé;1e quart IIe s. av. J.-C. (-200 - -175);https://www.youtube.com/watch?v=VWEu54QRIEc;https://collections.louvre.fr/media/cache/medium/0000000021/0000252531/0000632582_OG.JPG;locked;https://res.cloudinary.com/dqhw6sqcy/image/upload/v1678375432/ArtUp/dev_samothrace_qdiucm.png;https://res.cloudinary.com/dqhw6sqcy/image/upload/v1678375432/ArtUp/prod_samothrace_kbdnej.png;samothrace
